{
 "_credit": {
  "dataset": "The Structured Mishnah",
  "version": "2026-05-rev9",
  "attribution": "Moshe Kline, The Structured Mishnah (chaver.com)",
  "license": "CC BY 4.0",
  "license_url": "https://creativecommons.org/licenses/by/4.0/",
  "website": "https://chaver.com",
  "documentation": "https://chaver.com/Mishnah-New/api/index.json",
  "schema": "https://chaver.com/Mishnah-New/api/schema.json",
  "canonical": "https://chaver.com/Mishnah-New/api/zavim/3.json"
 },
 "reference": {
  "tractate": "Zavim",
  "tractate_he": "מסכת זבים",
  "slug": "zavim",
  "seder": "Tohorot",
  "seder_he": "טהרות",
  "chapter": 3,
  "chapter_key": "3",
  "chapter_he": "ג",
  "sefaria_title": "Mishnah Zavim",
  "sefaria_ref": "Mishnah Zavim 3"
 },
 "structure": {
  "shape": [
   [
    2,
    2
   ],
   [
    2,
    2
   ]
  ],
  "rows": 2,
  "cells": 4,
  "subdivisions": 5,
  "markers": {},
  "marker_count": 0
 },
 "rows": [
  {
   "row_num": 1,
   "cells": [
    {
     "label": "1א",
     "position": {
      "row": 1,
      "col": 1,
      "colspan": 2
     },
     "text": "1א\n)א( הזב והטהור שישבו בספינה או באסדא\nאו שרכבו על גבי בהמה\nאף על פי שאין בגדיהם נוגעים\nהרי אלו טמאים מדרס\nישבו על הנסר על הספסל על הגשיש שלמטה\nועל האכלונס בזמן שהן מחגירין\nעלו באילן שכחו רע בסוכה שכחה רע באילן יפה\nבסלם מצרי בזמן שאינו קבוע במסמר\nעל הכבש ועל הקורה ועל הדלת בזמן שאינם עשוין בטיט\nטמאים\nרבי יהודה מטהר",
     "runs": [
      {
       "text": "1א",
       "marker": null
      },
      {
       "text": "\n",
       "marker": null
      },
      {
       "text": ")א( הזב והטהור שישבו בספינה או באסדא",
       "marker": null
      },
      {
       "text": "\n",
       "marker": null
      },
      {
       "text": "או שרכבו על גבי בהמה",
       "marker": null
      },
      {
       "text": "\n",
       "marker": null
      },
      {
       "text": "אף על פי שאין בגדיהם נוגעים",
       "marker": null
      },
      {
       "text": "\n",
       "marker": null
      },
      {
       "text": "הרי אלו טמאים מדרס",
       "marker": null
      },
      {
       "text": "\n",
       "marker": null
      },
      {
       "text": "ישבו על הנסר על הספסל על הגשיש שלמטה",
       "marker": null
      },
      {
       "text": "\n",
       "marker": null
      },
      {
       "text": "ועל האכלונס בזמן שהן מחגירין",
       "marker": null
      },
      {
       "text": "\n",
       "marker": null
      },
      {
       "text": "עלו באילן שכחו רע בסוכה שכחה רע באילן יפה",
       "marker": null
      },
      {
       "text": "\n",
       "marker": null
      },
      {
       "text": "בסלם מצרי בזמן שאינו קבוע במסמר",
       "marker": null
      },
      {
       "text": "\n",
       "marker": null
      },
      {
       "text": "על הכבש ועל הקורה ועל הדלת בזמן שאינם עשוין בטיט",
       "marker": null
      },
      {
       "text": "\n",
       "marker": null
      },
      {
       "text": "טמאים",
       "marker": null
      },
      {
       "text": "\n",
       "marker": null
      },
      {
       "text": "רבי יהודה מטהר",
       "marker": null
      }
     ],
     "markers": []
    },
    {
     "label": "1ב",
     "position": {
      "row": 1,
      "col": 3,
      "colspan": 2
     },
     "text": "1ב\nA )ב( מגיפין או פותחין\nוחכמים אומרים עד שיהא זה מגיף וזה פותח\nB מעלין זה את זה מן הבור\nרבי יהודה אומר עד שיהא הטהור מעלה את הטמא\nC מפשילין בחבלין\nוחכמים אומרים עד שיהיה זה מושך הילך וזה מושך הילך\nD אורגים בין בעומדין בין ביושבין או טוחנין\nרבי שמעון מטהר בכלן חוץ מן הטוחנין ברחים שליד\nE פורקין מן החמור או טוענין\nבזמן שמשאם כבד טמאין\nבזמן שמשאם קל טהורין\nוכלן טהורין לבני הכנסת וטמאין לתרומה",
     "runs": [
      {
       "text": "1ב",
       "marker": null
      },
      {
       "text": "\nA",
       "marker": null
      },
      {
       "text": " ",
       "marker": null
      },
      {
       "text": ")ב( מגיפין או פותחין",
       "marker": null
      },
      {
       "text": "\n",
       "marker": null
      },
      {
       "text": "וחכמים אומרים עד שיהא זה מגיף וזה פותח",
       "marker": null
      },
      {
       "text": "\nB",
       "marker": null
      },
      {
       "text": " ",
       "marker": null
      },
      {
       "text": "מעלין זה את זה מן הבור",
       "marker": null
      },
      {
       "text": "\n",
       "marker": null
      },
      {
       "text": "רבי יהודה אומר עד שיהא הטהור מעלה את הטמא",
       "marker": null
      },
      {
       "text": "\nC",
       "marker": null
      },
      {
       "text": " ",
       "marker": null
      },
      {
       "text": "מפשילין בחבלין",
       "marker": null
      },
      {
       "text": "\n",
       "marker": null
      },
      {
       "text": "וחכמים אומרים עד שיהיה זה מושך הילך וזה מושך הילך",
       "marker": null
      },
      {
       "text": "\nD",
       "marker": null
      },
      {
       "text": " ",
       "marker": null
      },
      {
       "text": "אורגים בין בעומדין בין ביושבין או טוחנין",
       "marker": null
      },
      {
       "text": "\n",
       "marker": null
      },
      {
       "text": "רבי שמעון מטהר בכלן חוץ מן הטוחנין ברחים שליד",
       "marker": null
      },
      {
       "text": "\nE",
       "marker": null
      },
      {
       "text": " ",
       "marker": null
      },
      {
       "text": "פורקין מן החמור או טוענין",
       "marker": null
      },
      {
       "text": "\n",
       "marker": null
      },
      {
       "text": "בזמן שמשאם כבד טמאין",
       "marker": null
      },
      {
       "text": "\n",
       "marker": null
      },
      {
       "text": "בזמן שמשאם קל טהורין",
       "marker": null
      },
      {
       "text": "\n",
       "marker": null
      },
      {
       "text": "וכלן טהורין לבני הכנסת וטמאין לתרומה",
       "marker": null
      }
     ],
     "markers": [],
     "subdivisions": [
      {
       "label": "A",
       "text": ")ב( מגיפין או פותחין\nוחכמים אומרים עד שיהא זה מגיף וזה פותח",
       "markers": [],
       "mishnah_num_he": null
      },
      {
       "label": "B",
       "text": "מעלין זה את זה מן הבור\nרבי יהודה אומר עד שיהא הטהור מעלה את הטמא",
       "markers": [],
       "mishnah_num_he": "מעלין"
      },
      {
       "label": "C",
       "text": "מפשילין בחבלין\nוחכמים אומרים עד שיהיה זה מושך הילך וזה מושך הילך",
       "markers": [],
       "mishnah_num_he": "מפשילין"
      },
      {
       "label": "D",
       "text": "אורגים בין בעומדין בין ביושבין או טוחנין\nרבי שמעון מטהר בכלן חוץ מן הטוחנין ברחים שליד",
       "markers": [],
       "mishnah_num_he": "אורגים"
      },
      {
       "label": "E",
       "text": "פורקין מן החמור או טוענין\nבזמן שמשאם כבד טמאין\nבזמן שמשאם קל טהורין\nוכלן טהורין לבני הכנסת וטמאין לתרומה",
       "markers": [],
       "mishnah_num_he": "פורקין"
      }
     ]
    }
   ]
  },
  {
   "row_num": 2,
   "cells": [
    {
     "label": "2א",
     "position": {
      "row": 2,
      "col": 1,
      "colspan": 2
     },
     "text": "2א\n)ג( הזב והטהור שישבו בספינה גדולה\nאיזו היא ספינה גדולה\nרבי יהודה אומר כל שאינה יכולה להמיט באדם\nישבו על הנסר על הספסל על הגשיש שלמטה\nועל האכלונס בזמן שאינן מחגירין\nעלו באילן שכחו יפה בסוכה שכחה יפה\nובסלם צורי או מצרי בזמן שהוא קבוע במסמר\nעל הכבש על הקורה ועל הדלת בזמן שהן עשויין בטיט\nאפלו מצד אחד\nטהורין",
     "runs": [
      {
       "text": "2א",
       "marker": null
      },
      {
       "text": "\n",
       "marker": null
      },
      {
       "text": ")ג( הזב והטהור שישבו בספינה גדולה",
       "marker": null
      },
      {
       "text": "\n",
       "marker": null
      },
      {
       "text": "איזו היא ספינה גדולה",
       "marker": null
      },
      {
       "text": "\n",
       "marker": null
      },
      {
       "text": "רבי יהודה אומר כל שאינה יכולה להמיט באדם",
       "marker": null
      },
      {
       "text": "\n",
       "marker": null
      },
      {
       "text": "ישבו על הנסר על הספסל על הגשיש שלמטה",
       "marker": null
      },
      {
       "text": "\n",
       "marker": null
      },
      {
       "text": "ועל האכלונס בזמן שאינן מחגירין",
       "marker": null
      },
      {
       "text": "\n",
       "marker": null
      },
      {
       "text": "עלו באילן שכחו יפה בסוכה שכחה יפה",
       "marker": null
      },
      {
       "text": "\n",
       "marker": null
      },
      {
       "text": "ובסלם צורי או מצרי בזמן שהוא קבוע במסמר",
       "marker": null
      },
      {
       "text": "\n",
       "marker": null
      },
      {
       "text": "על הכבש על הקורה ועל הדלת בזמן שהן עשויין בטיט",
       "marker": null
      },
      {
       "text": "\n",
       "marker": null
      },
      {
       "text": "אפלו מצד אחד",
       "marker": null
      },
      {
       "text": "\n",
       "marker": null
      },
      {
       "text": "טהורין",
       "marker": null
      }
     ],
     "markers": []
    },
    {
     "label": "2ב",
     "position": {
      "row": 2,
      "col": 3,
      "colspan": 2
     },
     "text": "2ב\nהטהור מכה את הטמא טהור\nהטמא מכה את הטהור טמא\nשאם ימשך הטהור הרי הטמא נופל",
     "runs": [
      {
       "text": "2ב",
       "marker": null
      },
      {
       "text": "\n",
       "marker": null
      },
      {
       "text": "הטהור מכה את הטמא טהור",
       "marker": null
      },
      {
       "text": "\n",
       "marker": null
      },
      {
       "text": "הטמא מכה את הטהור טמא",
       "marker": null
      },
      {
       "text": "\n",
       "marker": null
      },
      {
       "text": "שאם ימשך הטהור הרי הטמא נופל",
       "marker": null
      }
     ],
     "markers": []
    }
   ]
  }
 ],
 "source_page": "https://chaver.com/Mishnah-New/Hebrew/Text/Seder%20Tohorot/Masechet%20Zavim/Masechet%20Zavim%20Perek%203.htm"
}
