{
 "_credit": {
  "dataset": "The Structured Mishnah",
  "version": "2026-05-rev9",
  "attribution": "Moshe Kline, The Structured Mishnah (chaver.com)",
  "license": "CC BY 4.0",
  "license_url": "https://creativecommons.org/licenses/by/4.0/",
  "website": "https://chaver.com",
  "documentation": "https://chaver.com/Mishnah-New/api/index.json",
  "schema": "https://chaver.com/Mishnah-New/api/schema.json",
  "canonical": "https://chaver.com/Mishnah-New/api/arakhin/3.json"
 },
 "reference": {
  "tractate": "Arakhin",
  "tractate_he": "מסכת ערכין",
  "slug": "arakhin",
  "seder": "Kodashim",
  "seder_he": "קדשים",
  "chapter": 3,
  "chapter_key": "3",
  "chapter_he": "ג",
  "sefaria_title": "Mishnah Arakhin",
  "sefaria_ref": "Mishnah Arakhin 3"
 },
 "structure": {
  "shape": [
   [
    4
   ],
   [
    2,
    2
   ],
   [
    4
   ],
   [
    2,
    2
   ],
   [
    4
   ]
  ],
  "rows": 5,
  "cells": 7,
  "subdivisions": 0,
  "markers": {},
  "marker_count": 0
 },
 "rows": [
  {
   "row_num": 1,
   "cells": [
    {
     "label": "1",
     "position": {
      "row": 1,
      "col": 1,
      "colspan": 4
     },
     "text": "1\n(א) יש\nבערכין להקל ולהחמיר\nבשדה אחזה להקל ולהחמיר\nבשור המועד שהמית את העבד להקל ולהחמיר\nבאונס ובמפתה ובמוציא שם רע להקל ולהחמיר",
     "runs": [
      {
       "text": "1",
       "marker": null
      },
      {
       "text": "\n",
       "marker": null
      },
      {
       "text": "(א) יש",
       "marker": null
      },
      {
       "text": "\n",
       "marker": null
      },
      {
       "text": "בערכין להקל ולהחמיר",
       "marker": null
      },
      {
       "text": "\n",
       "marker": null
      },
      {
       "text": "בשדה אחזה להקל ולהחמיר",
       "marker": null
      },
      {
       "text": "\n",
       "marker": null
      },
      {
       "text": "בשור המועד שהמית את העבד להקל ולהחמיר",
       "marker": null
      },
      {
       "text": "\n",
       "marker": null
      },
      {
       "text": "באונס ובמפתה ובמוציא שם רע להקל ולהחמיר",
       "marker": null
      }
     ],
     "markers": []
    }
   ]
  },
  {
   "row_num": 2,
   "cells": [
    {
     "label": "2א",
     "position": {
      "row": 2,
      "col": 1,
      "colspan": 2
     },
     "text": "2א\nיש בערכין להקל ולהחמיר\nכיצד\nאחד שהעריך את הנאה שבישראל ואת הכעור שבישראל\nנותן חמשים סלע\nואם אמר הרי דמיו עלי נותן את שויו",
     "runs": [
      {
       "text": "2א",
       "marker": null
      },
      {
       "text": "\n",
       "marker": null
      },
      {
       "text": "יש בערכין להקל ולהחמיר",
       "marker": null
      },
      {
       "text": "\n",
       "marker": null
      },
      {
       "text": "כיצד",
       "marker": null
      },
      {
       "text": "\n",
       "marker": null
      },
      {
       "text": "אחד שהעריך את הנאה שבישראל ואת הכעור שבישראל",
       "marker": null
      },
      {
       "text": "\n",
       "marker": null
      },
      {
       "text": "נותן חמשים סלע",
       "marker": null
      },
      {
       "text": "\n",
       "marker": null
      },
      {
       "text": "ואם אמר הרי דמיו עלי נותן את שויו",
       "marker": null
      }
     ],
     "markers": []
    },
    {
     "label": "2ב",
     "position": {
      "row": 2,
      "col": 3,
      "colspan": 2
     },
     "text": "2ב\n(ב) בשדה אחזה להקל ולהחמיר\nכיצד\nאחד המקדיש בחולת המחוז ואחד המקדיש בפרדסות סבסטי\nנותן בזרע חמר שעורים חמשים שקל כסף\nובשדה מקנה נותן את שויו\nרבי אליעזר אומר אחד שדה אחזה ואחד שדה מקנה\nמה בין שדה אחזה לשדה מקנה\nאלא שבשדה אחזה נותן חמש ובשדה מקנה אינו נותן חמש",
     "runs": [
      {
       "text": "2ב",
       "marker": null
      },
      {
       "text": "\n",
       "marker": null
      },
      {
       "text": "(ב) בשדה אחזה להקל ולהחמיר",
       "marker": null
      },
      {
       "text": "\n",
       "marker": null
      },
      {
       "text": "כיצד",
       "marker": null
      },
      {
       "text": "\n",
       "marker": null
      },
      {
       "text": "אחד המקדיש בחולת המחוז ואחד המקדיש בפרדסות סבסטי",
       "marker": null
      },
      {
       "text": "\n",
       "marker": null
      },
      {
       "text": "נותן בזרע חמר שעורים חמשים שקל כסף",
       "marker": null
      },
      {
       "text": "\n",
       "marker": null
      },
      {
       "text": "ובשדה מקנה נותן את שויו",
       "marker": null
      },
      {
       "text": "\n",
       "marker": null
      },
      {
       "text": "רבי אליעזר אומר אחד שדה אחזה ואחד שדה מקנה",
       "marker": null
      },
      {
       "text": "\n",
       "marker": null
      },
      {
       "text": "מה בין שדה אחזה לשדה מקנה",
       "marker": null
      },
      {
       "text": "\n",
       "marker": null
      },
      {
       "text": "אלא שבשדה אחזה נותן חמש ובשדה מקנה אינו נותן חמש",
       "marker": null
      }
     ],
     "markers": []
    }
   ]
  },
  {
   "row_num": 3,
   "cells": [
    {
     "label": "3",
     "position": {
      "row": 3,
      "col": 1,
      "colspan": 4
     },
     "text": "3\n(ג) בשור המועד שהמית את העבד להקל ולהחמיר\nכיצד\nאחד שהמית את הנאה שבעבדים ואת הכעור שבעבדים נותן שלשים סלע\nהמית בן חרין נותן את שויו\nחבל בזה ובזה משלם נזק שלם",
     "runs": [
      {
       "text": "3",
       "marker": null
      },
      {
       "text": "\n",
       "marker": null
      },
      {
       "text": "(ג) בשור המועד שהמית את העבד להקל ולהחמיר",
       "marker": null
      },
      {
       "text": "\n",
       "marker": null
      },
      {
       "text": "כיצד",
       "marker": null
      },
      {
       "text": "\n",
       "marker": null
      },
      {
       "text": "אחד שהמית את הנאה שבעבדים ואת הכעור שבעבדים נותן שלשים סלע",
       "marker": null
      },
      {
       "text": "\n",
       "marker": null
      },
      {
       "text": "המית בן חרין נותן את שויו",
       "marker": null
      },
      {
       "text": "\n",
       "marker": null
      },
      {
       "text": "חבל בזה ובזה משלם נזק שלם",
       "marker": null
      }
     ],
     "markers": []
    }
   ]
  },
  {
   "row_num": 4,
   "cells": [
    {
     "label": "4א",
     "position": {
      "row": 4,
      "col": 1,
      "colspan": 2
     },
     "text": "4א\n(ד) באונס ובמפתה להקל ולהחמיר\nכיצד\nאחד שאנס ופתה את הגדולה שבכהנה ואת הקטנה שבישראל\nנותן חמשים סלע\nוהבשת והפגם הכל לפי המביש והמתביש",
     "runs": [
      {
       "text": "4א",
       "marker": null
      },
      {
       "text": "\n",
       "marker": null
      },
      {
       "text": "(ד) באונס ובמפתה להקל ולהחמיר",
       "marker": null
      },
      {
       "text": "\n",
       "marker": null
      },
      {
       "text": "כיצד",
       "marker": null
      },
      {
       "text": "\n",
       "marker": null
      },
      {
       "text": "אחד שאנס ופתה את הגדולה שבכהנה ואת הקטנה שבישראל",
       "marker": null
      },
      {
       "text": "\n",
       "marker": null
      },
      {
       "text": "נותן חמשים סלע",
       "marker": null
      },
      {
       "text": "\n",
       "marker": null
      },
      {
       "text": "והבשת והפגם הכל לפי המביש והמתביש",
       "marker": null
      }
     ],
     "markers": []
    },
    {
     "label": "4ב",
     "position": {
      "row": 4,
      "col": 3,
      "colspan": 2
     },
     "text": "4ב\n(ה) במוציא שם רע להקל ולהחמיר\nכיצד\nאחד שהוציא שם רע על הגדולה שבכהנה ועל הקטנה שבישראל\nנותן מאה סלע",
     "runs": [
      {
       "text": "4ב",
       "marker": null
      },
      {
       "text": "\n",
       "marker": null
      },
      {
       "text": "(ה) במוציא שם רע להקל ולהחמיר",
       "marker": null
      },
      {
       "text": "\n",
       "marker": null
      },
      {
       "text": "כיצד",
       "marker": null
      },
      {
       "text": "\n",
       "marker": null
      },
      {
       "text": "אחד שהוציא שם רע על הגדולה שבכהנה ועל הקטנה שבישראל",
       "marker": null
      },
      {
       "text": "\n",
       "marker": null
      },
      {
       "text": "נותן מאה סלע",
       "marker": null
      }
     ],
     "markers": []
    }
   ]
  },
  {
   "row_num": 5,
   "cells": [
    {
     "label": "5",
     "position": {
      "row": 5,
      "col": 1,
      "colspan": 4
     },
     "text": "5\nנמצא האומר בפיו יתר מן העושה מעשה\nשכן מצינו שלא נחתם גזר דין על אבותינו במדבר אלא על לשון הרע\nשנאמר וינסו אתי זה עשר פעמים ולא שמעו בקולי",
     "runs": [
      {
       "text": "5",
       "marker": null
      },
      {
       "text": "\n",
       "marker": null
      },
      {
       "text": "נמצא האומר בפיו יתר מן העושה מעשה",
       "marker": null
      },
      {
       "text": "\n",
       "marker": null
      },
      {
       "text": "שכן מצינו שלא נחתם גזר דין על אבותינו במדבר אלא על לשון הרע",
       "marker": null
      },
      {
       "text": "\n",
       "marker": null
      },
      {
       "text": "שנאמר וינסו אתי זה עשר פעמים ולא שמעו בקולי",
       "marker": null
      }
     ],
     "markers": []
    }
   ]
  }
 ],
 "source_page": "https://chaver.com/Mishnah-New/Hebrew/Text/Seder%20Kodashim/Masechet%20Arakhin/Masechet%20Arakhin%20Perek%203.htm"
}
