{
 "_credit": {
  "dataset": "The Structured Mishnah",
  "version": "2026-05-rev9",
  "attribution": "Moshe Kline, The Structured Mishnah (chaver.com)",
  "license": "CC BY 4.0",
  "license_url": "https://creativecommons.org/licenses/by/4.0/",
  "website": "https://chaver.com",
  "documentation": "https://chaver.com/Mishnah-New/api/index.json",
  "schema": "https://chaver.com/Mishnah-New/api/schema.json",
  "canonical": "https://chaver.com/Mishnah-New/api/kelim/21.json"
 },
 "reference": {
  "tractate": "Kelim",
  "tractate_he": "מסכת כלים",
  "slug": "kelim",
  "seder": "Tohorot",
  "seder_he": "טהרות",
  "chapter": 21,
  "chapter_key": "21",
  "chapter_he": "כא",
  "sefaria_title": "Mishnah Kelim",
  "sefaria_ref": "Mishnah Kelim 21"
 },
 "structure": {
  "shape": [
   [
    1,
    1,
    1
   ],
   [
    1,
    1,
    1
   ]
  ],
  "rows": 2,
  "cells": 6,
  "subdivisions": 0,
  "markers": {},
  "marker_count": 0
 },
 "rows": [
  {
   "row_num": 1,
   "cells": [
    {
     "label": "1א",
     "position": {
      "row": 1,
      "col": 1,
      "colspan": 1
     },
     "text": "1א\n(א) הנוגע בכבד העליון\nבכבד התחתון\nבנירים ובקירוס\nובחוט שהעבירו על גבי הארגמן\nובעירה שאינו עתיד להחזירה\nטהור\nבנפש המסכת ובשתי העומד\nובכפול שהעבירו על גבי הארגמן\nובעירה שהוא עתיד להחזירה\nטמא",
     "runs": [
      {
       "text": "1א",
       "marker": null
      },
      {
       "text": "\n",
       "marker": null
      },
      {
       "text": "(א) הנוגע בכבד העליון",
       "marker": null
      },
      {
       "text": "\n",
       "marker": null
      },
      {
       "text": "בכבד התחתון",
       "marker": null
      },
      {
       "text": "\n",
       "marker": null
      },
      {
       "text": "בנירים ובקירוס",
       "marker": null
      },
      {
       "text": "\n",
       "marker": null
      },
      {
       "text": "ובחוט שהעבירו על גבי הארגמן",
       "marker": null
      },
      {
       "text": "\n",
       "marker": null
      },
      {
       "text": "ובעירה שאינו עתיד להחזירה",
       "marker": null
      },
      {
       "text": "\n",
       "marker": null
      },
      {
       "text": "טהור",
       "marker": null
      },
      {
       "text": "\n",
       "marker": null
      },
      {
       "text": "בנפש ה",
       "marker": null
      },
      {
       "text": "מסכת",
       "marker": null
      },
      {
       "text": " ובשתי העומד",
       "marker": null
      },
      {
       "text": "\n",
       "marker": null
      },
      {
       "text": "ובכפול שהעבירו על גבי הארגמן",
       "marker": null
      },
      {
       "text": "\n",
       "marker": null
      },
      {
       "text": "ובעירה שהוא עתיד להחזירה",
       "marker": null
      },
      {
       "text": "\n",
       "marker": null
      },
      {
       "text": "טמא",
       "marker": null
      }
     ],
     "markers": []
    },
    {
     "label": "1ב",
     "position": {
      "row": 1,
      "col": 2,
      "colspan": 1
     },
     "text": "1ב\nהנוגע בצמר שעל האימה באשויה\nטהור",
     "runs": [
      {
       "text": "1ב",
       "marker": null
      },
      {
       "text": "\n",
       "marker": null
      },
      {
       "text": "הנוגע בצמר שעל האימה באשויה",
       "marker": null
      },
      {
       "text": "\n",
       "marker": null
      },
      {
       "text": "טהור",
       "marker": null
      }
     ],
     "markers": []
    },
    {
     "label": "1ג",
     "position": {
      "row": 1,
      "col": 3,
      "colspan": 1
     },
     "text": "1ג\nהנוגע בפיקה\nעד שלא פרעה טמא\nמשפרעה טהור",
     "runs": [
      {
       "text": "1ג",
       "marker": null
      },
      {
       "text": "\n",
       "marker": null
      },
      {
       "text": "הנוגע בפיקה",
       "marker": null
      },
      {
       "text": "\n",
       "marker": null
      },
      {
       "text": "עד שלא פרעה טמא",
       "marker": null
      },
      {
       "text": "\n",
       "marker": null
      },
      {
       "text": "משפרעה טהור",
       "marker": null
      }
     ],
     "markers": []
    }
   ]
  },
  {
   "row_num": 2,
   "cells": [
    {
     "label": "2א",
     "position": {
      "row": 2,
      "col": 1,
      "colspan": 1
     },
     "text": "2א\n(ב) הנוגע בעל ובקטרב\nבעין ובעבות\nאפלו בשעת מלאכה\nטהור\nבחרב ובברך וביצול טמא\nבעין שלמתכת בלחיין ובעריין\nטמא\nרבי יהודה מטהר בלחיים\nשאינם עשויין אלא לרבות את העפר",
     "runs": [
      {
       "text": "2א",
       "marker": null
      },
      {
       "text": "\n",
       "marker": null
      },
      {
       "text": "(ב) הנוגע בעל ובקטרב",
       "marker": null
      },
      {
       "text": "\n",
       "marker": null
      },
      {
       "text": "בעין ובעבות",
       "marker": null
      },
      {
       "text": "\n",
       "marker": null
      },
      {
       "text": "אפלו בשעת מלאכה",
       "marker": null
      },
      {
       "text": "\n",
       "marker": null
      },
      {
       "text": "טהור",
       "marker": null
      },
      {
       "text": "\n",
       "marker": null
      },
      {
       "text": "בחרב ובברך וביצול טמא",
       "marker": null
      },
      {
       "text": "\n",
       "marker": null
      },
      {
       "text": "בעין שלמתכת בלחיין ובעריין",
       "marker": null
      },
      {
       "text": "\n",
       "marker": null
      },
      {
       "text": "טמא",
       "marker": null
      },
      {
       "text": "\n",
       "marker": null
      },
      {
       "text": "רבי יהודה מטהר בלחיים",
       "marker": null
      },
      {
       "text": "\n",
       "marker": null
      },
      {
       "text": "שאינם עשויין אלא לרבות את העפר",
       "marker": null
      }
     ],
     "markers": []
    },
    {
     "label": "2ב",
     "position": {
      "row": 2,
      "col": 2,
      "colspan": 1
     },
     "text": "2ב\n(ג) הנוגע ביד מגרה\nמכאן ומכאן טמא\nבחוט ובמשיחה באמה ובסניפין\nבמכבש שלחרש ובקשטנית\nטהור\nרבי יהודה אומר\nאף הנוגע במלבן שלמסר הגדול טהור",
     "runs": [
      {
       "text": "2ב",
       "marker": null
      },
      {
       "text": "\n",
       "marker": null
      },
      {
       "text": "(ג) הנוגע ביד מגרה",
       "marker": null
      },
      {
       "text": "\n",
       "marker": null
      },
      {
       "text": "מכאן ומכאן טמא",
       "marker": null
      },
      {
       "text": "\n",
       "marker": null
      },
      {
       "text": "בחוט ובמשיחה באמה ובסניפין",
       "marker": null
      },
      {
       "text": "\n",
       "marker": null
      },
      {
       "text": "במכבש שלחרש ובקשטנית",
       "marker": null
      },
      {
       "text": "\n",
       "marker": null
      },
      {
       "text": "טהור",
       "marker": null
      },
      {
       "text": "\n",
       "marker": null
      },
      {
       "text": "רבי יהודה אומר",
       "marker": null
      },
      {
       "text": "\n",
       "marker": null
      },
      {
       "text": "אף הנוגע במלבן שלמסר הגדול טהור",
       "marker": null
      }
     ],
     "markers": []
    },
    {
     "label": "2ג",
     "position": {
      "row": 2,
      "col": 3,
      "colspan": 1
     },
     "text": "2ג\nהנוגע ביתר ובקשת\nאף על פי שהיא מתוחה\nטהור\nמצודת האישות טהורה\nרבי יהודה אומר\nכל זמן שהיא מתוחה חבור",
     "runs": [
      {
       "text": "2ג",
       "marker": null
      },
      {
       "text": "\n",
       "marker": null
      },
      {
       "text": "הנוגע ביתר ובקשת",
       "marker": null
      },
      {
       "text": "\n",
       "marker": null
      },
      {
       "text": "אף על פי שהיא מתוחה",
       "marker": null
      },
      {
       "text": "\n",
       "marker": null
      },
      {
       "text": "טהור",
       "marker": null
      },
      {
       "text": "\n",
       "marker": null
      },
      {
       "text": "מצודת האישות טהורה",
       "marker": null
      },
      {
       "text": "\n",
       "marker": null
      },
      {
       "text": "רבי יהודה אומר",
       "marker": null
      },
      {
       "text": "\n",
       "marker": null
      },
      {
       "text": "כל זמן שהיא מתוחה חבור",
       "marker": null
      }
     ],
     "markers": []
    }
   ]
  }
 ],
 "source_page": "https://chaver.com/Mishnah-New/Hebrew/Text/Seder%20Tohorot/Masechet%20Kelim/Masechet%20Kelim%20Perek%2021.htm"
}
