{
 "_credit": {
  "dataset": "The Structured Mishnah",
  "version": "2026-05-rev9",
  "attribution": "Moshe Kline, The Structured Mishnah (chaver.com)",
  "license": "CC BY 4.0",
  "license_url": "https://creativecommons.org/licenses/by/4.0/",
  "website": "https://chaver.com",
  "documentation": "https://chaver.com/Mishnah-New/api/index.json",
  "schema": "https://chaver.com/Mishnah-New/api/schema.json",
  "canonical": "https://chaver.com/Mishnah-New/api/shabbat/5.json"
 },
 "reference": {
  "tractate": "Shabbat",
  "tractate_he": "מסכת שבת",
  "slug": "shabbat",
  "seder": "Moed",
  "seder_he": "מועד",
  "chapter": 5,
  "chapter_key": "5",
  "chapter_he": "ה",
  "sefaria_title": "Mishnah Shabbat",
  "sefaria_ref": "Mishnah Shabbat 5"
 },
 "structure": {
  "shape": [
   [
    2,
    2
   ],
   [
    2,
    2
   ]
  ],
  "rows": 2,
  "cells": 4,
  "subdivisions": 0,
  "markers": {
   "vertical1": 10
  },
  "marker_count": 10
 },
 "rows": [
  {
   "row_num": 1,
   "cells": [
    {
     "label": "1א",
     "position": {
      "row": 1,
      "col": 1,
      "colspan": 2
     },
     "text": "1א\n(א) במה בהמה יוצאה ובמה אינה יוצאה\nיוצא הגמל באפסר\nוהנאקה בחטם\nוהלבדקיס בפרמביא\nוהסוס בשיר\nוכל בעלי השיר\nיוצאים בשיר ונמשכים בשיר\nומזין עליהם וטובלין במקומן\n",
     "runs": [
      {
       "text": "1א",
       "marker": null
      },
      {
       "text": "\n",
       "marker": null
      },
      {
       "text": "(א) במה בהמה יוצאה ובמה אינה יוצאה",
       "marker": null
      },
      {
       "text": "\nיוצא ",
       "marker": null
      },
      {
       "text": "הגמל",
       "marker": "vertical1"
      },
      {
       "text": " באפסר",
       "marker": null
      },
      {
       "text": "\nוהנאקה בחטם",
       "marker": null
      },
      {
       "text": "\nוהלבדקיס בפרמביא",
       "marker": null
      },
      {
       "text": "\nוהסוס בשיר",
       "marker": null
      },
      {
       "text": "\nוכל בעלי השיר",
       "marker": null
      },
      {
       "text": "\nיוצאים בשיר ",
       "marker": null
      },
      {
       "text": "ונמשכים",
       "marker": "vertical1"
      },
      {
       "text": " בשיר",
       "marker": null
      },
      {
       "text": "\nומזין עליהם וטובלין במקומן",
       "marker": null
      },
      {
       "text": "\n",
       "marker": null
      }
     ],
     "markers": [
      {
       "type": "vertical1",
       "text": "הגמל"
      },
      {
       "type": "vertical1",
       "text": "ונמשכים"
      }
     ]
    },
    {
     "label": "1ב",
     "position": {
      "row": 1,
      "col": 3,
      "colspan": 2
     },
     "text": "1ב\n(ב) חמור יוצא במרדעת\nבזמן שהיא קשורה לו\nהזכרים יוצאין לבובין\nהרחלות יוצאות שחוזות כבולות וכבונות\nהעזים יוצאות צרורות\nרבי יוסי אוסר בכלן\nחוץ מן הרחלין הכבונות\nרבי יהודה אומר\nהעזים יוצאות צרורות ליבש אבל לא לחלב",
     "runs": [
      {
       "text": "1ב",
       "marker": null
      },
      {
       "text": "\n",
       "marker": null
      },
      {
       "text": "(ב) ",
       "marker": null
      },
      {
       "text": "חמור יוצא במרדעת",
       "marker": "vertical1"
      },
      {
       "text": "\nבזמן שהיא קשורה לו",
       "marker": "vertical1"
      },
      {
       "text": "\n",
       "marker": "vertical1"
      },
      {
       "text": "הזכרים יוצאין לבובין",
       "marker": null
      },
      {
       "text": "\nהרחלות יוצאות שחוזות כבולות וכבונות",
       "marker": null
      },
      {
       "text": "\nהעזים יוצאות צרורות",
       "marker": null
      },
      {
       "text": "\nרבי יוסי אוסר בכלן",
       "marker": null
      },
      {
       "text": "\nחוץ מן הרחלין הכבונות",
       "marker": null
      },
      {
       "text": "\nרבי יהודה אומר",
       "marker": null
      },
      {
       "text": "\nהעזים יוצאות צרורות ליבש אבל לא לחלב",
       "marker": null
      }
     ],
     "markers": [
      {
       "type": "vertical1",
       "text": "חמור יוצא במרדעת"
      },
      {
       "type": "vertical1",
       "text": "\nבזמן שהיא קשורה לו"
      },
      {
       "type": "vertical1",
       "text": "\n"
      }
     ]
    }
   ]
  },
  {
   "row_num": 2,
   "cells": [
    {
     "label": "2א",
     "position": {
      "row": 2,
      "col": 1,
      "colspan": 2
     },
     "text": "2א\n(ג) ובמה אינה יוצאה\nלא יצא גמל במטוטלת\nלא עקוד\nולא רגול\nוכן שאר כל הבהמות\nלא יקשר גמלים זה בזה וימשך\nאבל מכניס חבלים לתוך ידו וימשך\nובלבד שלא יכרך\n",
     "runs": [
      {
       "text": "2א",
       "marker": null
      },
      {
       "text": "\n",
       "marker": null
      },
      {
       "text": "(ג) ובמה אינה יוצאה",
       "marker": null
      },
      {
       "text": "\nלא יצא ",
       "marker": null
      },
      {
       "text": "גמל",
       "marker": "vertical1"
      },
      {
       "text": " במטוטלת",
       "marker": null
      },
      {
       "text": "\nלא עקוד",
       "marker": null
      },
      {
       "text": "\nולא רגול",
       "marker": null
      },
      {
       "text": "\nוכן שאר כל הבהמות",
       "marker": null
      },
      {
       "text": "\nלא יקשר גמלים זה בזה ",
       "marker": null
      },
      {
       "text": "וימשך",
       "marker": "vertical1"
      },
      {
       "text": "\nאבל מכניס חבלים לתוך ידו וימשך",
       "marker": null
      },
      {
       "text": "\nובלבד שלא יכרך",
       "marker": null
      },
      {
       "text": "\n",
       "marker": null
      }
     ],
     "markers": [
      {
       "type": "vertical1",
       "text": "גמל"
      },
      {
       "type": "vertical1",
       "text": "וימשך"
      }
     ]
    },
    {
     "label": "2ב",
     "position": {
      "row": 2,
      "col": 3,
      "colspan": 2
     },
     "text": "2ב\n(ד) אין חמור יוצא במרדעת\nבזמן שאינה קשורה לו\nולא בזוג אף על פי שהוא פקוק\nולא בסלם שבצוארו\nולא ברצועה שברגלו\nואין התרנגולין יוצאין בחוטין\nולא ברצועות שברגליהם\nואין הזכרים יוצאין\nבעגלה שתחת האליה שלהן\nואין הרחלים יוצאות חנונות\nואין העגל יוצא בגימון\nולא פרה בעור הקפד\nולא ברצועה שבין קרניה\nפרתו שלרבי אלעזר בן עזריה\nהיתה יוצאה ברצועה שבין קרניה\nשלא ברצון חכמים",
     "runs": [
      {
       "text": "2ב",
       "marker": null
      },
      {
       "text": "\n",
       "marker": null
      },
      {
       "text": "(ד) ",
       "marker": null
      },
      {
       "text": "אין חמור יוצא במרדעת",
       "marker": "vertical1"
      },
      {
       "text": "\nבזמן שאינה קשורה לו",
       "marker": "vertical1"
      },
      {
       "text": "\n",
       "marker": "vertical1"
      },
      {
       "text": "ולא בזוג אף על פי שהוא פקוק",
       "marker": null
      },
      {
       "text": "\nולא בסלם שבצוארו",
       "marker": null
      },
      {
       "text": "\nולא ברצועה שברגלו",
       "marker": null
      },
      {
       "text": "\nואין התרנגולין יוצאין בחוטין",
       "marker": null
      },
      {
       "text": "\nולא ברצועות שברגליהם",
       "marker": null
      },
      {
       "text": "\nואין הזכרים יוצאין",
       "marker": null
      },
      {
       "text": "\nבעגלה שתחת האליה שלהן",
       "marker": null
      },
      {
       "text": "\nואין הרחלים יוצאות חנונות",
       "marker": null
      },
      {
       "text": "\nואין העגל יוצא בגימון",
       "marker": null
      },
      {
       "text": "\nולא פרה בעור הקפד",
       "marker": null
      },
      {
       "text": "\nולא ברצועה שבין קרניה",
       "marker": null
      },
      {
       "text": "\nפרתו שלרבי אלעזר בן עזריה",
       "marker": null
      },
      {
       "text": "\nהיתה יוצאה ברצועה שבין קרניה",
       "marker": null
      },
      {
       "text": "\nשלא ברצון חכמים",
       "marker": null
      }
     ],
     "markers": [
      {
       "type": "vertical1",
       "text": "אין חמור יוצא במרדעת"
      },
      {
       "type": "vertical1",
       "text": "\nבזמן שאינה קשורה לו"
      },
      {
       "type": "vertical1",
       "text": "\n"
      }
     ]
    }
   ]
  }
 ],
 "source_page": "https://chaver.com/Mishnah-New/Hebrew/Text/Seder%20Moed/Masechet%20Shabbat/Masechet%20Shabbat%20Perek%205.htm"
}
