{
 "_credit": {
  "dataset": "The Structured Mishnah",
  "version": "2026-05-rev9",
  "attribution": "Moshe Kline, The Structured Mishnah (chaver.com)",
  "license": "CC BY 4.0",
  "license_url": "https://creativecommons.org/licenses/by/4.0/",
  "website": "https://chaver.com",
  "documentation": "https://chaver.com/Mishnah-New/api/index.json",
  "schema": "https://chaver.com/Mishnah-New/api/schema.json",
  "canonical": "https://chaver.com/Mishnah-New/api/mikvaot/3.json"
 },
 "reference": {
  "tractate": "Mikvaot",
  "tractate_he": "מסכת מקואות",
  "slug": "mikvaot",
  "seder": "Tohorot",
  "seder_he": "טהרות",
  "chapter": 3,
  "chapter_key": "3",
  "chapter_he": "ג",
  "sefaria_title": "Mishnah Mikvaot",
  "sefaria_ref": "Mishnah Mikvaot 3"
 },
 "structure": {
  "shape": [
   [
    2,
    2
   ],
   [
    2,
    2
   ]
  ],
  "rows": 2,
  "cells": 4,
  "subdivisions": 0,
  "markers": {},
  "marker_count": 0
 },
 "rows": [
  {
   "row_num": 1,
   "cells": [
    {
     "label": "1א",
     "position": {
      "row": 1,
      "col": 1,
      "colspan": 2
     },
     "text": "1א\n(א) רבי יוסי אומר\nשני מקואות שאין בהם ארבעים סאה\nונפלו לזה לג ומחצה ולזה לג ומחצה ונתערבו\nכשרים מפני שלא נקרא עליהן שם פסול\nאבל מקוה שאין בו ארבעים סאה\nונפלו בו שלשה לגין ונחלק לשנים\nפסול מפני שנקרא עליו שם פסול\nורבי יהושע מכשיר שהיה רבי יהושע אומר\nכל מקוה שאין בו ארבעים סאה\nונפלו לו שלשה לגין וחסר אפלו קרטוב\nכשר מפני שחסרו לו שלשה לגין\nוחכמים אומרים\nלעולם הוא בפסולו עד שיצא ממנו מלואו ועוד\n(ב) כיצד הבור שבחצר ונפלו לו שלשה לגין\nלעולם הוא בפסולו עד שיצא ממנו מלואו ועוד\nאו עד שיעמיד בחצר ארבעים סאה\nויטהרו העליונים מן התחתונים\nרבי אלעזר בן עזריה פוסל אלא אם כן פקק",
     "runs": [
      {
       "text": "1א",
       "marker": null
      },
      {
       "text": "\n",
       "marker": null
      },
      {
       "text": "(א) רבי יוסי אומר",
       "marker": null
      },
      {
       "text": "\n",
       "marker": null
      },
      {
       "text": "שני מקואות שאין בהם ארבעים סאה",
       "marker": null
      },
      {
       "text": "\n",
       "marker": null
      },
      {
       "text": "ונפלו לזה לג ומחצה ולזה לג ומחצה ונתערבו",
       "marker": null
      },
      {
       "text": "\n",
       "marker": null
      },
      {
       "text": "כשרים מפני שלא נקרא עליהן שם פסול",
       "marker": null
      },
      {
       "text": "\n",
       "marker": null
      },
      {
       "text": "אבל מקוה שאין בו ארבעים סאה",
       "marker": null
      },
      {
       "text": "\n",
       "marker": null
      },
      {
       "text": "ונפלו בו שלשה לגין ונחלק לשנים",
       "marker": null
      },
      {
       "text": "\n",
       "marker": null
      },
      {
       "text": "פסול מפני שנקרא עליו שם פסול",
       "marker": null
      },
      {
       "text": "\n",
       "marker": null
      },
      {
       "text": "ורבי יהושע מכשיר שהיה רבי יהושע אומר",
       "marker": null
      },
      {
       "text": "\n",
       "marker": null
      },
      {
       "text": "כל מקוה שאין בו ארבעים סאה",
       "marker": null
      },
      {
       "text": "\n",
       "marker": null
      },
      {
       "text": "ונפלו לו שלשה לגין וחסר אפלו קרטוב",
       "marker": null
      },
      {
       "text": "\n",
       "marker": null
      },
      {
       "text": "כשר מפני שחסרו לו שלשה לגין",
       "marker": null
      },
      {
       "text": "\n",
       "marker": null
      },
      {
       "text": "וחכמים אומרים",
       "marker": null
      },
      {
       "text": "\n",
       "marker": null
      },
      {
       "text": "לעולם הוא בפסולו עד שיצא ממנו מלואו ועוד",
       "marker": null
      },
      {
       "text": "\n",
       "marker": null
      },
      {
       "text": "(ב) כיצד הבור שבחצר ונפלו לו שלשה לגין",
       "marker": null
      },
      {
       "text": "\n",
       "marker": null
      },
      {
       "text": "לעולם הוא בפסולו עד שיצא ממנו מלואו ועוד",
       "marker": null
      },
      {
       "text": "\n",
       "marker": null
      },
      {
       "text": "או עד שיעמיד בחצר ארבעים סאה",
       "marker": null
      },
      {
       "text": "\n",
       "marker": null
      },
      {
       "text": "ויטהרו העליונים מן התחתונים",
       "marker": null
      },
      {
       "text": "\n",
       "marker": null
      },
      {
       "text": "רבי אלעזר בן עזריה פוסל אלא אם כן פקק",
       "marker": null
      }
     ],
     "markers": []
    },
    {
     "label": "1ב",
     "position": {
      "row": 1,
      "col": 3,
      "colspan": 2
     },
     "text": "1ב\n(ג) בור שהוא מלא מים שאובין\nוהאמה נכנסת לו ויוצאה ממנו\nלעולם הוא בפסולו\nעד שיתחשב שלא נשתיר מן הראשונים שלשה לגין",
     "runs": [
      {
       "text": "1ב",
       "marker": null
      },
      {
       "text": "\n",
       "marker": null
      },
      {
       "text": "(ג) בור שהוא מלא מים שאובין",
       "marker": null
      },
      {
       "text": "\n",
       "marker": null
      },
      {
       "text": "והאמה נכנסת לו ויוצאה ממנו",
       "marker": null
      },
      {
       "text": "\n",
       "marker": null
      },
      {
       "text": "לעולם הוא בפסולו",
       "marker": null
      },
      {
       "text": "\n",
       "marker": null
      },
      {
       "text": "עד שיתחשב שלא נשתיר מן הראשונים שלשה לגין",
       "marker": null
      }
     ],
     "markers": []
    }
   ]
  },
  {
   "row_num": 2,
   "cells": [
    {
     "label": "2א",
     "position": {
      "row": 2,
      "col": 1,
      "colspan": 2
     },
     "text": "2א\nשנים שהיו מטילין למקוה זה לג ומחצה וזה לג ומחצה\nהסוחט את כסותו ומטיל ממקומות הרבה\nוהמערה מן הצרצור ומטיל ממקומות הרבה\nרבי עקיבא מכשיר\nוחכמים פוסלין\nאמר רבי עקיבא לא אמרו מטילין אלא מטיל\nאמרו לו לא כך ולא כך אמרו\nאלא שנפלו לו שלשה לגין\n(ד) מכלי אחד משנים ומשלשה מצטרפין\nומארבעה אין מצטרפין",
     "runs": [
      {
       "text": "2א",
       "marker": null
      },
      {
       "text": "\n",
       "marker": null
      },
      {
       "text": "שנים שהיו מטילין למקוה זה לג ומחצה וזה לג ומחצה",
       "marker": null
      },
      {
       "text": "\n",
       "marker": null
      },
      {
       "text": "הסוחט את כסותו ומטיל ממקומות הרבה",
       "marker": null
      },
      {
       "text": "\n",
       "marker": null
      },
      {
       "text": "והמערה מן הצרצור ומטיל ממקומות הרבה",
       "marker": null
      },
      {
       "text": "\n",
       "marker": null
      },
      {
       "text": "רבי עקיבא מכשיר",
       "marker": null
      },
      {
       "text": "\n",
       "marker": null
      },
      {
       "text": "וחכמים פוסלין",
       "marker": null
      },
      {
       "text": "\n",
       "marker": null
      },
      {
       "text": "אמר רבי עקיבא לא אמרו מטילין אלא מטיל",
       "marker": null
      },
      {
       "text": "\n",
       "marker": null
      },
      {
       "text": "אמרו לו לא כך ולא כך אמרו",
       "marker": null
      },
      {
       "text": "\n",
       "marker": null
      },
      {
       "text": "אלא שנפלו לו שלשה לגין",
       "marker": null
      },
      {
       "text": "\n",
       "marker": null
      },
      {
       "text": "(ד) מכלי אחד משנים ומשלשה מצטרפין",
       "marker": null
      },
      {
       "text": "\n",
       "marker": null
      },
      {
       "text": "ומארבעה אין מצטרפין",
       "marker": null
      }
     ],
     "markers": []
    },
    {
     "label": "2ב",
     "position": {
      "row": 2,
      "col": 3,
      "colspan": 2
     },
     "text": "2ב\nבעל קרי החולה שנפלו עליו תשעה קבין מים\nוטהור שנפלו על ראשו ועל רבו שלשה לגין מים שאובין\nמכלי אחד משנים ומשלשה מצטרפין\nמארבעה אין מצטרפין\nבמה דברים אמורים\nבזמן שהתחיל השני עד שלא פסק הראשון\nובמה דברים אמורים\nבזמן שלא נתכון לרבות\nאבל נתכון לרבות אפלו קרטוב בכל השנה\nמצטרפין לשלשה לגין",
     "runs": [
      {
       "text": "2ב",
       "marker": null
      },
      {
       "text": "\n",
       "marker": null
      },
      {
       "text": "בעל קרי החולה שנפלו עליו תשעה קבין מים",
       "marker": null
      },
      {
       "text": "\n",
       "marker": null
      },
      {
       "text": "וטהור שנפלו על ראשו ועל רבו שלשה לגין מים שאובין",
       "marker": null
      },
      {
       "text": "\n",
       "marker": null
      },
      {
       "text": "מכלי אחד משנים ומשלשה מצטרפין",
       "marker": null
      },
      {
       "text": "\n",
       "marker": null
      },
      {
       "text": "מארבעה אין מצטרפין",
       "marker": null
      },
      {
       "text": "\n",
       "marker": null
      },
      {
       "text": "במה דברים אמורים",
       "marker": null
      },
      {
       "text": "\n",
       "marker": null
      },
      {
       "text": "בזמן שהתחיל השני עד שלא פסק הראשון",
       "marker": null
      },
      {
       "text": "\n",
       "marker": null
      },
      {
       "text": "ובמה דברים אמורים",
       "marker": null
      },
      {
       "text": "\n",
       "marker": null
      },
      {
       "text": "בזמן שלא נתכון לרבות",
       "marker": null
      },
      {
       "text": "\n",
       "marker": null
      },
      {
       "text": "אבל נתכון לרבות אפלו קרטוב בכל השנה",
       "marker": null
      },
      {
       "text": "\n",
       "marker": null
      },
      {
       "text": "מצטרפין לשלשה לגין",
       "marker": null
      }
     ],
     "markers": []
    }
   ]
  }
 ],
 "source_page": "https://chaver.com/Mishnah-New/Hebrew/Text/Seder%20Tohorot/Masechet%20Mikvaot/Masechet%20Mikvaot%20Perek%203.htm"
}
