{
 "_credit": {
  "dataset": "The Structured Mishnah",
  "version": "2026-05-rev9",
  "attribution": "Moshe Kline, The Structured Mishnah (chaver.com)",
  "license": "CC BY 4.0",
  "license_url": "https://creativecommons.org/licenses/by/4.0/",
  "website": "https://chaver.com",
  "documentation": "https://chaver.com/Mishnah-New/api/index.json",
  "schema": "https://chaver.com/Mishnah-New/api/schema.json",
  "canonical": "https://chaver.com/Mishnah-New/api/shabbat/20.json"
 },
 "reference": {
  "tractate": "Shabbat",
  "tractate_he": "מסכת שבת",
  "slug": "shabbat",
  "seder": "Moed",
  "seder_he": "מועד",
  "chapter": 20,
  "chapter_key": "20",
  "chapter_he": "כ",
  "sefaria_title": "Mishnah Shabbat",
  "sefaria_ref": "Mishnah Shabbat 20"
 },
 "structure": {
  "shape": [
   [
    2,
    2
   ],
   [
    2,
    2
   ],
   [
    2,
    2
   ],
   [
    2,
    2
   ]
  ],
  "rows": 4,
  "cells": 8,
  "subdivisions": 0,
  "markers": {
   "horizontal1": 9
  },
  "marker_count": 9
 },
 "rows": [
  {
   "row_num": 1,
   "cells": [
    {
     "label": "1א",
     "position": {
      "row": 1,
      "col": 1,
      "colspan": 2
     },
     "text": "1א\n(א) רבי אליעזר אומר\nתולין את המשמרת ביום טוב\nונותנין לתלויה בשבת\nוחכמים אומרים\nאין תולין את המשמרת ביום טוב\nואין נותנין לתלויה בשבת\nאבל נותנין לתלויה ביום טוב",
     "runs": [
      {
       "text": "1א",
       "marker": null
      },
      {
       "text": "\n",
       "marker": null
      },
      {
       "text": "(א) רבי אליעזר אומר",
       "marker": null
      },
      {
       "text": "\nתולין את המשמרת ",
       "marker": null
      },
      {
       "text": "ביום טוב",
       "marker": "horizontal1"
      },
      {
       "text": "\nונותנין לתלויה ",
       "marker": null
      },
      {
       "text": "בשבת",
       "marker": "horizontal1"
      },
      {
       "text": "\nוחכמים אומרים",
       "marker": null
      },
      {
       "text": "\nאין תולין את המשמרת ביום טוב",
       "marker": null
      },
      {
       "text": "\nואין נותנין לתלויה בשבת",
       "marker": null
      },
      {
       "text": "\nאבל נותנין לתלויה ביום טוב",
       "marker": null
      }
     ],
     "markers": [
      {
       "type": "horizontal1",
       "text": "ביום טוב"
      },
      {
       "type": "horizontal1",
       "text": "בשבת"
      }
     ]
    },
    {
     "label": "1ב",
     "position": {
      "row": 1,
      "col": 3,
      "colspan": 2
     },
     "text": "1ב\n(ב) נותנין מים על גבי השמרים בשביל שיצלו\nומסננין את היין בסודרין ובכפיפה מצרית\nונותנין ביצה במסננת שלחרדל\nועושין אנומלין בשבת\nרבי יהודה אומר בשבת בכוס\nביום טוב בלגין\nובמועד בחבית\nרבי צדוק אומר הכל לפי האורחין",
     "runs": [
      {
       "text": "1ב",
       "marker": null
      },
      {
       "text": "\n",
       "marker": null
      },
      {
       "text": "(ב) נותנין מים על גבי השמרים בשביל שיצלו",
       "marker": null
      },
      {
       "text": "\nומסננין את היין בסודרין ובכפיפה מצרית",
       "marker": null
      },
      {
       "text": "\nונותנין ביצה במסננת שלחרדל",
       "marker": null
      },
      {
       "text": "\nועושין אנומלין ",
       "marker": null
      },
      {
       "text": "בשבת",
       "marker": "horizontal1"
      },
      {
       "text": "\nרבי יהודה אומר בשבת בכוס",
       "marker": null
      },
      {
       "text": "\n",
       "marker": null
      },
      {
       "text": "ביום",
       "marker": "horizontal1"
      },
      {
       "text": " ",
       "marker": null
      },
      {
       "text": "טוב",
       "marker": "horizontal1"
      },
      {
       "text": " בלגין",
       "marker": null
      },
      {
       "text": "\nובמועד בחבית",
       "marker": null
      },
      {
       "text": "\nרבי צדוק אומר הכל לפי האורחין",
       "marker": null
      }
     ],
     "markers": [
      {
       "type": "horizontal1",
       "text": "בשבת"
      },
      {
       "type": "horizontal1",
       "text": "ביום"
      },
      {
       "type": "horizontal1",
       "text": "טוב"
      }
     ]
    }
   ]
  },
  {
   "row_num": 2,
   "cells": [
    {
     "label": "2א",
     "position": {
      "row": 2,
      "col": 1,
      "colspan": 2
     },
     "text": "2א\n(ג) אין שורין את החלתית בפושרין\nאבל נותן לתוך החמץ\nואין שורין את הכרשינין ולא שפין אותן\nאבל נותן לתוך הכברה או לתוך הכלכלה",
     "runs": [
      {
       "text": "2א",
       "marker": null
      },
      {
       "text": "\n",
       "marker": null
      },
      {
       "text": "(ג) אין שורין את החלתית בפושרין",
       "marker": null
      },
      {
       "text": "\nאבל נותן לתוך החמץ",
       "marker": null
      },
      {
       "text": "\nואין שורין את הכרשינין ולא שפין אותן",
       "marker": null
      },
      {
       "text": "\nאבל נותן לתוך ",
       "marker": null
      },
      {
       "text": "הכברה",
       "marker": "horizontal1"
      },
      {
       "text": " או לתוך הכלכלה",
       "marker": null
      }
     ],
     "markers": [
      {
       "type": "horizontal1",
       "text": "הכברה"
      }
     ]
    },
    {
     "label": "2ב",
     "position": {
      "row": 2,
      "col": 3,
      "colspan": 2
     },
     "text": "2ב\nאין כוברין את התבן בכברה\nולא יתננו על גבי מקום גבוה בשביל שירד המוץ\nאבל נוטל הוא בכברה ונותן לתוך האבוס",
     "runs": [
      {
       "text": "2ב",
       "marker": null
      },
      {
       "text": "\n",
       "marker": null
      },
      {
       "text": "אין כוברין את התבן בכברה",
       "marker": null
      },
      {
       "text": "\nולא יתננו על גבי מקום גבוה בשביל שירד המוץ",
       "marker": null
      },
      {
       "text": "\nאבל נוטל הוא ",
       "marker": null
      },
      {
       "text": "בכברה",
       "marker": "horizontal1"
      },
      {
       "text": " ונותן לתוך האבוס",
       "marker": null
      }
     ],
     "markers": [
      {
       "type": "horizontal1",
       "text": "בכברה"
      }
     ]
    }
   ]
  },
  {
   "row_num": 3,
   "cells": [
    {
     "label": "3א",
     "position": {
      "row": 3,
      "col": 1,
      "colspan": 2
     },
     "text": "3א\n(ד) גורפין מלפני הפטם\nומסלקין לצדדין מפני הרעי\nדברי רבי דוסא\nוחכמים אוסרין",
     "runs": [
      {
       "text": "3א",
       "marker": null
      },
      {
       "text": "\n",
       "marker": null
      },
      {
       "text": "(ד) גורפין ",
       "marker": null
      },
      {
       "text": "מלפני",
       "marker": "horizontal1"
      },
      {
       "text": " הפטם",
       "marker": null
      },
      {
       "text": "\nומסלקין לצדדין מפני הרעי",
       "marker": null
      },
      {
       "text": "\nדברי רבי דוסא",
       "marker": null
      },
      {
       "text": "\nוחכמים אוסרין",
       "marker": null
      }
     ],
     "markers": [
      {
       "type": "horizontal1",
       "text": "מלפני"
      }
     ]
    },
    {
     "label": "3ב",
     "position": {
      "row": 3,
      "col": 3,
      "colspan": 2
     },
     "text": "3ב\nנוטלין מלפני בהמה זו\nונותנין לפני בהמה זו בשבת",
     "runs": [
      {
       "text": "3ב",
       "marker": null
      },
      {
       "text": "\n",
       "marker": null
      },
      {
       "text": "נוטלין ",
       "marker": null
      },
      {
       "text": "מלפני",
       "marker": "horizontal1"
      },
      {
       "text": " בהמה זו",
       "marker": null
      },
      {
       "text": "\nונותנין לפני בהמה זו בשבת",
       "marker": null
      }
     ],
     "markers": [
      {
       "type": "horizontal1",
       "text": "מלפני"
      }
     ]
    }
   ]
  },
  {
   "row_num": 4,
   "cells": [
    {
     "label": "4א",
     "position": {
      "row": 4,
      "col": 1,
      "colspan": 2
     },
     "text": "4א\n(ה) הקש שעל גבי המטה\nלא ינענעו בידו\nאלא מנענעו בגופו\nואם היה מאכל בהמה\nאו שהיה עליו כר או סדין\nמנענעו בידו",
     "runs": [
      {
       "text": "4א",
       "marker": null
      },
      {
       "text": "\n",
       "marker": null
      },
      {
       "text": "(ה) הקש שעל גבי המטה",
       "marker": null
      },
      {
       "text": "\nלא ינענעו בידו",
       "marker": null
      },
      {
       "text": "\nאלא מנענעו בגופו",
       "marker": null
      },
      {
       "text": "\nואם היה מאכל בהמה",
       "marker": null
      },
      {
       "text": "\nאו שהיה עליו כר או סדין",
       "marker": null
      },
      {
       "text": "\nמנענעו בידו",
       "marker": null
      }
     ],
     "markers": []
    },
    {
     "label": "4ב",
     "position": {
      "row": 4,
      "col": 3,
      "colspan": 2
     },
     "text": "4ב\nמכבש שלבעלי בתים\nמתירין אבל לא כובשין\nושלכובסין\nלא יגע בו\nרבי יהודה אומר\nאם היה מתר מערב שבת מתיר את כלו ושומטו",
     "runs": [
      {
       "text": "4ב",
       "marker": null
      },
      {
       "text": "\n",
       "marker": null
      },
      {
       "text": "מכבש שלבעלי בתים",
       "marker": null
      },
      {
       "text": "\nמתירין אבל לא כובשין",
       "marker": null
      },
      {
       "text": "\nושלכובסין",
       "marker": null
      },
      {
       "text": "\nלא יגע בו",
       "marker": null
      },
      {
       "text": "\nרבי יהודה אומר",
       "marker": null
      },
      {
       "text": "\nאם היה מתר מערב שבת מתיר את כלו ושומטו",
       "marker": null
      }
     ],
     "markers": []
    }
   ]
  }
 ],
 "source_page": "https://chaver.com/Mishnah-New/Hebrew/Text/Seder%20Moed/Masechet%20Shabbat/Masechet%20Shabbat%20Perek%2020.htm"
}
